{
  "version": "1.0.0",
  "exportDate": "2026-04-05T06:16:15.400Z",
  "projectName": "LSDEDE-DEMO-TS",
  "primaryLanguage": "fr",
  "locales": [
    "fr",
    "en",
    "ja",
    "zh"
  ],
  "dictionaries": [
    {
      "uuid": "89871280-7933-49f5-8522-82f5c9371d0f",
      "id": "inventory",
      "rows": [
        {
          "key": "carrot"
        }
      ]
    },
    {
      "uuid": "d4cedb7f-78e1-490a-b982-94ef2727b43d",
      "id": "party",
      "rows": [
        {
          "key": "l1"
        },
        {
          "key": "l2"
        },
        {
          "key": "l3"
        }
      ]
    }
  ],
  "signatures": [
    {
      "uuid": "060dfc91-5cec-4777-9460-84ae00f404b7",
      "id": "moveCameraToLabel",
      "params": [
        {
          "label": "id",
          "type": "enum",
          "enumOptions": [
            {
              "id": "boss",
              "label": "boss"
            },
            {
              "id": "l4",
              "label": "l4"
            },
            {
              "id": "l1",
              "label": "l1"
            }
          ]
        },
        {
          "label": "duration",
          "type": "number"
        }
      ]
    },
    {
      "uuid": "7404e9c3-2cb3-4a55-92ce-ddb6de07f29f",
      "id": "shakeCamera",
      "params": [
        {
          "label": "intensity",
          "type": "number"
        },
        {
          "label": "duration",
          "type": "number"
        }
      ]
    },
    {
      "uuid": "ad033563-7d76-4178-917e-283dc59c87b0",
      "id": "moveCharacterAt",
      "params": [
        {
          "label": "id",
          "type": "string"
        },
        {
          "label": "x",
          "type": "number"
        },
        {
          "label": "y",
          "type": "number"
        },
        {
          "label": "absolut",
          "type": "boolean"
        }
      ]
    }
  ],
  "scenes": [
    {
      "uuid": "268a4c3e-7693-4ce7-8d36-4b0fd2e4a052",
      "label": "simple-dialog-flow",
      "date": "05/04/2026",
      "entryBlockId": "c39d69d1-f508-45a8-8084-09a68f6916e1",
      "blocks": [
        {
          "uuid": "39a5f6d9-59cb-479f-bd17-28bfda31663a",
          "type": "DIALOG",
          "properties": [],
          "label": "player_suggestion-AI",
          "structureKey": "__blueprints__.simple-dialog-flow.player_suggestion-AI",
          "content": "Restons calmes les amis. \nSi cette carotte géante est réelle, ce serait le festin du siècle pour tout notre clan. \nSi c'est un leurre, on aura au moins fait notre gym matinale et pris l'air. \nQu'est-ce qu'on risque vraiment à aller voir ?",
          "dialogueText": {
            "en": "Let's stay calm, friends.\nIf this giant carrot is real, it'd be the feast of the century for our whole clan.\nIf it's a decoy, at least we'll have gotten our morning exercise and some fresh air.\nWhat do we really have to lose by going to check it out?",
            "fr": "Restons calmes les amis. \nSi cette carotte géante est réelle, ce serait le festin du siècle pour tout notre clan. \nSi c'est un leurre, on aura au moins fait notre gym matinale et pris l'air. \nQu'est-ce qu'on risque vraiment à aller voir ?",
            "ja": "みんな、落ち着こう。\nもしこの巨大なニンジンが本物なら、僕たちの一族みんなにとって世紀のご馳走になるだろう。\nもしそれが作り物だったとしても、少なくとも朝の運動にはなるし、外の空気も吸える。\n見に行くだけで、一体何を失うって言うんだい？",
            "zh": "保持冷静，朋友们。\n如果这根巨型胡萝卜是真的，那对我们整个族群来说，这将是世纪盛宴。\n如果只是个诱饵，我们至少也做了早间运动，呼吸了新鲜空气。\n我们去看看又能有什么真正的风险呢？"
          },
          "parentLabels": [
            "__blueprints__"
          ],
          "metadata": {
            "characters": [
              {
                "uuid": "60383860-3694-4f1e-9ae4-c1b5bdc9d842",
                "id": "l4",
                "name": "l4"
              }
            ]
          }
        },
        {
          "uuid": "d13045ac-a103-4e10-acb8-12399c11a2c1",
          "type": "DIALOG",
          "properties": [],
          "label": "player_warning-AI",
          "structureKey": "__blueprints__.simple-dialog-flow.player_warning-AI",
          "content": "C'est ça, l3, on essaiera ta technique de distraction métaphysique si on croise un prédateur affamé. En attendant, on avance en silence. \nEt l1, si c'est encore une vieille chaussette humaine, tu assures les tours de garde tout le mois !",
          "dialogueText": {
            "en": "Right, l3, we'll try your metaphysical distraction technique if we run into a hungry predator. In the meantime, we move in silence.\nAnd l1, if it's another old human sock, you'll be on guard duty for the entire month!",
            "fr": "C'est ça, l3, on essaiera ta technique de distraction métaphysique si on croise un prédateur affamé. En attendant, on avance en silence. \nEt l1, si c'est encore une vieille chaussette humaine, tu assures les tours de garde tout le mois !",
            "ja": "ああ、そうかい、L3。もし腹を空かせた捕食者に出くわしたら、お前のその形而上学的な惑わしの戦法とやらを試してみるさ。それまでは、静かに進むんだ。\nそしてL1、もしそれがまた古い人間の靴下だったりしたら、その月は全部、お前が見張り番をやるんだからな！",
            "zh": "好的吧，l3，如果我们遇到饥饿的捕食者，我们会试试你那套形而上学的注意力分散法。在此之前，我们先悄悄前进。\n还有l1，如果（我们找到的）又是什么人类的破烂玩意儿，你这个月就负责站岗放哨了！"
          },
          "parentLabels": [
            "__blueprints__"
          ],
          "metadata": {
            "characters": [
              {
                "uuid": "60383860-3694-4f1e-9ae4-c1b5bdc9d842",
                "id": "l4",
                "name": "l4"
              }
            ]
          }
        },
        {
          "uuid": "6ed885e4-eb2d-4916-979d-339a30ae36ae",
          "type": "DIALOG",
          "properties": [],
          "label": "rabbit_hype-AI",
          "structureKey": "__blueprints__.simple-dialog-flow.rabbit_hype-AI",
          "content": "C'est exactement l'esprit d'aventure qu'il nous fallait, l4 ! \nOn va devenir des légendes vivantes, les lapins qui ont découvert le trésor orange ! \nJe peux déjà sentir son parfum sucré flotter dans la brise, c'est forcément par là, suivez-moi !",
          "dialogueText": {
            "en": "This is just the spirit of adventure we needed, l4!\nWe're going to become living legends, the rabbits who discovered the orange treasure!\nI can already smell its sweet scent floating on the breeze, it must be this way, follow me!",
            "fr": "C'est exactement l'esprit d'aventure qu'il nous fallait, l4 ! \nOn va devenir des légendes vivantes, les lapins qui ont découvert le trésor orange ! \nJe peux déjà sentir son parfum sucré flotter dans la brise, c'est forcément par là, suivez-moi !",
            "ja": "l4、これこそ僕らが求めていた冒険心ってやつさ！\n僕らがオレンジの宝を見つけたウサギとして、生きた伝説になるんだ！\nもう甘い香りが風に乗って漂ってくるのが分かるよ。間違いない、あっちだ！さあ、ついてきて！",
            "zh": "这正是我们需要的冒险精神，l4！\n我们将会成为活着的传奇，那些发现了橙色宝藏的兔子！\n我已经能闻到它甜美的香气在微风中飘荡，肯定就在那边，跟我来！"
          },
          "parentLabels": [
            "__blueprints__"
          ],
          "metadata": {
            "characters": [
              {
                "uuid": "0d848982-9b5e-4437-b0d7-96a97ae78538",
                "id": "l1",
                "name": "l1"
              }
            ]
          }
        },
        {
          "uuid": "067e705a-7696-45da-8a74-16f681dc83a3",
          "type": "DIALOG",
          "properties": [],
          "label": "rabbit_philosophy-AI",
          "structureKey": "__blueprints__.simple-dialog-flow.rabbit_philosophy-AI",
          "content": "Mais le temps n'est qu'une construction mentale, l2. \nEst-ce que la carotte existe vraiment si personne n'est là pour la grignoter avec amour ? \nPeut-être que c'est nous qui sommes tous coincés dans le rêve d'un grand navet cosmique.",
          "dialogueText": {
            "en": "But time is just a mental construct, l2.\nDoes the carrot truly exist if no one is there to lovingly nibble on it?\nPerhaps we are all just stuck in the dream of a giant cosmic turnip.",
            "fr": "Mais le temps n'est qu'une construction mentale, l2. \nEst-ce que la carotte existe vraiment si personne n'est là pour la grignoter avec amour ? \nPeut-être que c'est nous qui sommes tous coincés dans le rêve d'un grand navet cosmique.",
            "ja": "しかし、時間は単なる心の構造に過ぎない、l2。\n誰も愛情を込めてかじる者がいなければ、人参は本当に存在するのだろうか？\nもしかしたら、私たちみんなが閉じ込められているのは、巨大な宇宙のカブの夢の中なのかもしれない。",
            "zh": "可是时间不过是一种心理建构，l2。\n如果没有人在那里带着爱意啃食它，胡萝卜真的存在吗？\n也许我们都只是被困在一个巨大宇宙萝卜的梦境里。"
          },
          "parentLabels": [
            "__blueprints__"
          ],
          "metadata": {
            "characters": [
              {
                "uuid": "0f16b34e-f9d5-493f-8bbc-8a2d1418f221",
                "id": "l3",
                "name": "l3"
              }
            ]
          }
        },
        {
          "uuid": "cb1663f1-5833-456e-b033-e325d6077d71",
          "type": "DIALOG",
          "properties": [],
          "label": "rabbit_resignation-AI",
          "structureKey": "__blueprints__.simple-dialog-flow.rabbit_resignation-AI",
          "content": "Ton nez nous a déjà conduits dans une mare de boue malodorante la semaine dernière, triple idiot. \nMais bon, je suppose que je dois vous accompagner pour m'assurer que vous ne finissiez pas en civet par pure distraction. \nAllez, en route.",
          "dialogueText": {
            "en": "Your nose already led us into a stinking mud puddle last week, you triple idiot. But anyway, I suppose I have to come with you to make sure you don't end up in a stew out of sheer absentmindedness. Come on, let's go.",
            "fr": "Ton nez nous a déjà conduits dans une mare de boue malodorante la semaine dernière, triple idiot. \nMais bon, je suppose que je dois vous accompagner pour m'assurer que vous ne finissiez pas en civet par pure distraction. \nAllez, en route.",
            "ja": "先週も、お前の鼻のせいで、俺たちは臭い泥沼に突っ込んだんだぞ、この大バカ者め！\nまあ、しょうがない。お前が油断して捕まって、シチューにでもされないように、俺がついていってやるよ。\nさあ、行くぞ。",
            "zh": "你的鼻子上周就把我们带到了臭烘烘的泥坑里，你这糊涂蛋。\n但算了，我想我得跟着你，免得你因为心不在焉，最后成了别人的炖肉。\n走吧。"
          },
          "parentLabels": [
            "__blueprints__"
          ],
          "metadata": {
            "characters": [
              {